Studio,Start time,,Classes,Teacher,Studio,Duration
Broadway Dance Center,8:30 am EDT,none,Ed Dept ORIENTATION,ITP Master Class,Studio 1,1 hour
Broadway Dance Center,9:00 am EDT,https://clients.mindbodyonline.com/ASP/res_a.asp?tg=22&classId=19222&classDate=4/15/2024&clsLoc=1,IN-PERSON: Basic HIP-HOP with TweetBoogie,Tweetboogie,Studio B,1 hour &30 minutes
Broadway Dance Center,9:30 am EDT,none,Ed Dept DANCER TOOLKIT w/ Michaela McGowan,ITP Master Class,Studio 1,1 hour
Broadway Dance Center,10:30 am EDT,https://clients.mindbodyonline.com/ASP/res_a.asp?tg=22&classId=18665&classDate=4/15/2024&clsLoc=1,IN-PERSON: Beg BALLET with Michele Moreno,Michele Moreno,Studio 1,1 hour &30 minutes
Broadway Dance Center,10:30 am EDT,https://clients.mindbodyonline.com/ASP/res_a.asp?tg=22&classId=19214&classDate=4/15/2024&clsLoc=1,IN-PERSON: Int CONTEMPORARY with Blue,Blue,Studio 4,1 hour &30 minutes
Broadway Dance Center,12:00 pm EDT,https://clients.mindbodyonline.com/ASP/res_a.asp?tg=22&classId=18103&classDate=4/15/2024&clsLoc=1,IN-PERSON: Adv Beg BALLET with Natalya Stavro,Natalya Stavro,Studio A,1 hour &30 minutes
Broadway Dance Center,12:00 pm EDT,https://clients.mindbodyonline.com/ASP/res_a.asp?tg=22&classId=19280&classDate=4/15/2024&clsLoc=1,IN-PERSON: Adv Beg HIP-HOP with AntBoogie,AntBoogie,Studio 5,1 hour &30 minutes
Broadway Dance Center,12:00 pm EDT,https://clients.mindbodyonline.com/ASP/res_a.asp?tg=22&classId=18680&classDate=4/15/2024&clsLoc=1,IN-PERSON: Beg THEATER with Ian Klein,Ian Klein,Studio 2,1 hour &30 minutes
Broadway Dance Center,1:30 pm EDT,https://clients.mindbodyonline.com/ASP/res_a.asp?tg=22&classId=18705&classDate=4/15/2024&clsLoc=1,IN-PERSON: Adv Beg CONTEMPORARY with Jaclyn Walsh,Jaclyn Walsh,Studio A,1 hour &30 minutes
Broadway Dance Center,1:30 pm EDT,https://clients.mindbodyonline.com/ASP/res_a.asp?tg=22&classId=18177&classDate=4/15/2024&clsLoc=1,IN-PERSON: Basic TAP with Brent McBeth,Danielle Jackman (3),Studio B,1 hour &30 minutes
Broadway Dance Center,1:30 pm EDT,https://clients.mindbodyonline.com/ASP/res_a.asp?tg=22&classId=19448&classDate=4/15/2024&clsLoc=1,IN-PERSON: Int Adv JAZZ FUNK/HIP-HOP with Hamilton Evans,Hamilton Evans,Studio 5,1 hour &30 minutes
Broadway Dance Center,3:00 pm EDT,https://clients.mindbodyonline.com/ASP/res_a.asp?tg=22&classId=18699&classDate=4/15/2024&clsLoc=1,IN-PERSON: Adv Beg BALLET with Deanna Doyle,Deanna Doyle,Studio 1,1 hour &30 minutes
Broadway Dance Center,3:00 pm EDT,https://clients.mindbodyonline.com/ASP/res_a.asp?tg=22&classId=19408&classDate=4/15/2024&clsLoc=1,IN-PERSON: Basic THEATER with Melodye Redding,Melodye Redding,Studio 2,1 hour &30 minutes
Broadway Dance Center,3:00 pm EDT,https://clients.mindbodyonline.com/ASP/res_a.asp?tg=22&classId=18994&classDate=4/15/2024&clsLoc=1,IN-PERSON: Beg MECHANICS OF TAP with Ja'Bowen Dixon,Ja'Bowen Dixon,Studio B,1 hour &30 minutes
Broadway Dance Center,4:30 pm EDT,https://clients.mindbodyonline.com/ASP/res_a.asp?tg=22&classId=18786&classDate=4/15/2024&clsLoc=1,IN-PERSON: Int Adv THEATER with Chip Abbott,Chip Abbott,Studio A,1 hour &30 minutes
Broadway Dance Center,4:30 pm EDT,https://clients.mindbodyonline.com/ASP/res_a.asp?tg=22&classId=18708&classDate=4/15/2024&clsLoc=1,IN-PERSON: Beg BALLET with Dorit Koppel,Dorit Koppel,Studio 1,1 hour &30 minutes
Broadway Dance Center,4:30 pm EDT,https://clients.mindbodyonline.com/ASP/res_a.asp?tg=22&classId=19296&classDate=4/15/2024&clsLoc=1,IN-PERSON: Int Adv HIP-HOP with David Thomas,David Thomas,Studio 5,1 hour &30 minutes
Broadway Dance Center,6:00 pm EDT,https://clients.mindbodyonline.com/ASP/res_a.asp?tg=22&classId=19235&classDate=4/15/2024&clsLoc=1,IN-PERSON: Adv Beg TAP with Josh Walden,Josh Walden,Studio B,1 hour &30 minutes
Broadway Dance Center,6:00 pm EDT,https://clients.mindbodyonline.com/ASP/res_a.asp?tg=22&classId=19259&classDate=4/15/2024&clsLoc=1,IN-PERSON: Basic BALLET with Sarah Simon Wolff,Sarah Simon Wolff,Studio 4,1 hour &30 minutes
Broadway Dance Center,6:00 pm EDT,https://clients.mindbodyonline.com/ASP/res_a.asp?tg=22&classId=19223&classDate=4/15/2024&clsLoc=1,IN-PERSON: Int Adv STREET JAZZ with Kenichi Kasamatsu,Kenichi Kasamatsu,Studio 5,1 hour &30 minutes
Broadway Dance Center,7:30 pm EDT,https://clients.mindbodyonline.com/ASP/res_a.asp?tg=22&classId=18240&classDate=4/15/2024&clsLoc=1,IN-PERSON: Basic CONTEMPORARY JAZZ with Stacie Webster,Stacie Webster,Studio A,1 hour &30 minutes
Broadway Dance Center,7:30 pm EDT,https://clients.mindbodyonline.com/ASP/res_a.asp?tg=22&classId=19441&classDate=4/15/2024&clsLoc=1,IN-PERSON: Int Adv CONTEMPORARY THEATER with Jon Rua,Jon Rua,Studio 5,1 hour &30 minutes
Broadway Dance Center,7:30 pm EDT,https://clients.mindbodyonline.com/ASP/res_a.asp?tg=22&classId=19079&classDate=4/15/2024&clsLoc=1,IN-PERSON: Int THEATER TAP with Kaitlyn Frank,Kaitlyn Frank,Studio B,1 hour &30 minutes
Broadway Dance Center,9:00 pm EDT,https://clients.mindbodyonline.com/ASP/res_a.asp?tg=22&classId=19230&classDate=4/15/2024&clsLoc=1,IN-PERSON: Beg HEELS with Courtney Sauls,Courtney Sauls,Studio 5,1 hour &30 minutes
Broadway Dance Center,9:00 am EDT,https://clients.mindbodyonline.com/ASP/res_a.asp?tg=22&classId=18673&classDate=4/15/2024&clsLoc=1,IN-PERSON: Adv Beg CONTEMPORARY JAZZ with Ashley Lynne King,Ashley Lynne King,Studio A,1 hour &30 minutes
Broadway Dance Center,9:15 am EDT,https://clients.mindbodyonline.com/ASP/res_a.asp?tg=22&classId=18728&classDate=4/15/2024&clsLoc=1,IN-PERSON: All Levels YOGA AND MEDITATION with Lauren Marsaglia,Lauren Marsaglia,Studio 2,1 hour &15 minutes
Broadway Dance Center,10:30 am EDT,https://clients.mindbodyonline.com/ASP/res_a.asp?tg=22&classId=19178&classDate=4/15/2024&clsLoc=1,IN-PERSON: Basic THEATER with Joey Tierno,Eliah James Furlong (1),Studio A,1 hour &30 minutes
Broadway Dance Center,10:30 am EDT,https://clients.mindbodyonline.com/ASP/res_a.asp?tg=22&classId=19284&classDate=4/15/2024&clsLoc=1,IN-PERSON: Beg HIP-HOP with Paolo Penala,Paolo Slice Penala,Studio B,1 hour &30 minutes
Broadway Dance Center,11:00 am EDT,https://clients.mindbodyonline.com/ASP/res_a.asp?tg=22&classId=18870&classDate=4/15/2024&clsLoc=1,IN-PERSON: All Levels PILATES with Linda Farrell,Linda Farrell,Studio 2,1 hour
Broadway Dance Center,12:00 pm EDT,https://clients.mindbodyonline.com/ASP/res_a.asp?tg=22&classId=18676&classDate=4/15/2024&clsLoc=1,IN-PERSON: Adv Beg CONTEMPORARY LYRICAL with Tracie Stanfield,Phil Orsano (2),Studio 1,1 hour &30 minutes
Broadway Dance Center,12:00 pm EDT,https://clients.mindbodyonline.com/ASP/res_a.asp?tg=22&classId=18112&classDate=4/15/2024&clsLoc=1,IN-PERSON: Adv Beg TAP with Jill Kenney,Jill Kenney,Studio B,1 hour &30 minutes
Broadway Dance Center,1:30 pm EDT,https://clients.mindbodyonline.com/ASP/res_a.asp?tg=22&classId=18718&classDate=4/15/2024&clsLoc=1,IN-PERSON: Basic HIP-HOP with Geheny Rivera,Geheny Rivera,Studio 2,1 hour &30 minutes
Broadway Dance Center,1:30 pm EDT,https://clients.mindbodyonline.com/ASP/res_a.asp?tg=22&classId=19209&classDate=4/15/2024&clsLoc=1,IN-PERSON: Beg JAZZ with Sheila Barker,Sheila Barker,Studio 1,1 hour &30 minutes
Broadway Dance Center,1:30 pm EDT,https://clients.mindbodyonline.com/ASP/res_a.asp?tg=22&classId=18690&classDate=4/15/2024&clsLoc=1,IN-PERSON: Int THEATER with Lizz Picini,Josh Walden (4),Studio 4,1 hour &30 minutes
Broadway Dance Center,3:00 pm EDT,https://clients.mindbodyonline.com/ASP/res_a.asp?tg=22&classId=19220&classDate=4/15/2024&clsLoc=1,IN-PERSON: Adv Beg STREET JAZZ with Bo Belza,Bo Belza,Studio 5,1 hour &30 minutes
Broadway Dance Center,3:00 pm EDT,https://clients.mindbodyonline.com/ASP/res_a.asp?tg=22&classId=19226&classDate=4/15/2024&clsLoc=1,IN-PERSON: Beg CONTEMPORARY with Eric Campros,Eric Campros,Studio 4,1 hour &30 minutes
Broadway Dance Center,3:00 pm EDT,https://clients.mindbodyonline.com/ASP/res_a.asp?tg=22&classId=18703&classDate=4/15/2024&clsLoc=1,IN-PERSON: Int Adv JAZZ with Debbie Roshe,Debbie Roshe,Studio A,1 hour &30 minutes
Broadway Dance Center,4:30 pm EDT,https://clients.mindbodyonline.com/ASP/res_a.asp?tg=22&classId=19224&classDate=4/15/2024&clsLoc=1,IN-PERSON: Adv Beg TURNS AND TECHNIQUE with Ali Koinoglou,Ali Koinoglou,Studio 4,1 hour &30 minutes
Broadway Dance Center,4:30 pm EDT,https://clients.mindbodyonline.com/ASP/res_a.asp?tg=22&classId=19332&classDate=4/15/2024&clsLoc=1,IN-PERSON: Beg STREET STYLES with J Lyn,J Lyn,Studio 2,1 hour &30 minutes
Broadway Dance Center,4:30 pm EDT,https://clients.mindbodyonline.com/ASP/res_a.asp?tg=22&classId=18118&classDate=4/15/2024&clsLoc=1,IN-PERSON: Int TAP with Ray Hesselink,Ray Hesselink,Studio B,1 hour &30 minutes
Broadway Dance Center,6:00 pm EDT,https://clients.mindbodyonline.com/ASP/res_a.asp?tg=22&classId=19278&classDate=4/15/2024&clsLoc=1,IN-PERSON: Adv Beg THEATER with Elyn Collier,Elyn Collier,Studio A,1 hour &30 minutes
Broadway Dance Center,6:00 pm EDT,https://clients.mindbodyonline.com/ASP/res_a.asp?tg=22&classId=19166&classDate=4/15/2024&clsLoc=1,IN-PERSON: Beg COMMERCIAL JAZZ with Debbie Wilson,Debbie Wilson,Studio 1,1 hour &30 minutes
Broadway Dance Center,7:30 pm EDT,https://clients.mindbodyonline.com/ASP/res_a.asp?tg=22&classId=19315&classDate=4/15/2024&clsLoc=1,IN-PERSON: All Levels BURLESQUE JAZZ with Tony Guerrero,Tony Guerrero,Studio 1,1 hour &30 minutes
Broadway Dance Center,7:30 pm EDT,https://clients.mindbodyonline.com/ASP/res_a.asp?tg=22&classId=18753&classDate=4/15/2024&clsLoc=1,IN-PERSON: Beg STREET JAZZ with Elodie Dufroux,Elodie Dufroux,Studio 2,1 hour &30 minutes
Broadway Dance Center,7:30 pm EDT,https://clients.mindbodyonline.com/ASP/res_a.asp?tg=22&classId=19322&classDate=4/15/2024&clsLoc=1,IN-PERSON: Int Adv STREET JAZZ with Keenan Cooks,Kenneth Herrera (5),Studio 4,1 hour &30 minutes
Broadway Dance Center,9:00 pm EDT,https://clients.mindbodyonline.com/ASP/res_a.asp?tg=22&classId=18886&classDate=4/15/2024&clsLoc=1,IN-PERSON: Adv STREET STYLES with Jay Mills,Masumi Kambayashi (6),Studio 1,1 hour &30 minutes
Broadway Dance Center,9:00 pm EDT,https://clients.mindbodyonline.com/ASP/res_a.asp?tg=22&classId=18247&classDate=4/15/2024&clsLoc=1,IN-PERSON: Int CONTEMPORARY FUSION with Camryn Brothers,Kristalyn Gill (7),Studio A,1 hour &30 minutes
