Studio,Start time,,Classes,Teacher,Studio,Duration
Broadway Dance Center,9:00 am EDT,none,Ed Dept Commercial Performance w/ Marcus Allan Cobb,ITP Master Class,Studio 5,1 hour &30 minutes
Broadway Dance Center,9:00 am EDT,https://clients.mindbodyonline.com/ASP/res_a.asp?tg=22&classId=19370&classDate=5/8/2024&clsLoc=1,IN-PERSON: Beg LYRICAL with Emily Bufferd,Emily Bufferd,Studio A,1 hour &30 minutes
Broadway Dance Center,10:30 am EDT,https://clients.mindbodyonline.com/ASP/res_a.asp?tg=22&classId=18290&classDate=5/8/2024&clsLoc=1,IN-PERSON: Adv Beg TAP with Dre Torres,Aubrey Cheek (1),Studio B,1 hour &30 minutes
Broadway Dance Center,10:30 am EDT,https://clients.mindbodyonline.com/ASP/res_a.asp?tg=22&classId=18700&classDate=5/8/2024&clsLoc=1,IN-PERSON: Int BALLET with Deanna Doyle,Deanna Doyle,Studio 1,1 hour &30 minutes
Broadway Dance Center,12:00 pm EDT,https://clients.mindbodyonline.com/ASP/res_a.asp?tg=22&classId=18688&classDate=5/8/2024&clsLoc=1,IN-PERSON: Adv Beg BALLET with Natalya Stavro,Natalya Stavro,Studio 1,1 hour &30 minutes
Broadway Dance Center,12:00 pm EDT,https://clients.mindbodyonline.com/ASP/res_a.asp?tg=22&classId=18681&classDate=5/8/2024&clsLoc=1,IN-PERSON: Adv Beg THEATER with Ian Klein,Adam Wedesky (2),Studio 2,1 hour &30 minutes
Broadway Dance Center,12:00 pm EDT,https://clients.mindbodyonline.com/ASP/res_a.asp?tg=22&classId=19187&classDate=5/8/2024&clsLoc=1,IN-PERSON: Beg JAZZ FUNK with Chio,Chio,Studio 5,1 hour &30 minutes
Broadway Dance Center,1:30 pm EDT,https://clients.mindbodyonline.com/ASP/res_a.asp?tg=22&classId=18280&classDate=5/8/2024&clsLoc=1,IN-PERSON: Basic TAP with Avital Asuleen,Avital Asuleen,Studio B,1 hour &30 minutes
Broadway Dance Center,1:30 pm EDT,https://clients.mindbodyonline.com/ASP/res_a.asp?tg=22&classId=19251&classDate=5/8/2024&clsLoc=1,IN-PERSON: Int CONTEMPORARY FUSION with Camryn Brothers,Camryn Brothers,Studio 4,1 hour &30 minutes
Broadway Dance Center,3:00 pm EDT,https://clients.mindbodyonline.com/ASP/res_a.asp?tg=22&classId=19210&classDate=5/8/2024&clsLoc=1,IN-PERSON: Adv Beg JAZZ with Sheila Barker,Sheila Barker,Studio 1,1 hour &30 minutes
Broadway Dance Center,3:00 pm EDT,https://clients.mindbodyonline.com/ASP/res_a.asp?tg=22&classId=18701&classDate=5/8/2024&clsLoc=1,IN-PERSON: Basic BALLET with Deanna Doyle,Deanna Doyle,Studio A,1 hour &30 minutes
Broadway Dance Center,3:00 pm EDT,https://clients.mindbodyonline.com/ASP/res_a.asp?tg=22&classId=19361&classDate=5/8/2024&clsLoc=1,IN-PERSON: Int CONTEMPORARY FUSION with Phil Orsano,Phil Orsano,Studio 4,1 hour &30 minutes
Broadway Dance Center,4:30 pm EDT,https://clients.mindbodyonline.com/ASP/res_a.asp?tg=22&classId=19281&classDate=5/8/2024&clsLoc=1,IN-PERSON: Adv Beg HIP-HOP with AntBoogie,AntBoogie,Studio 5,1 hour &30 minutes
Broadway Dance Center,4:30 pm EDT,https://clients.mindbodyonline.com/ASP/res_a.asp?tg=22&classId=19359&classDate=5/8/2024&clsLoc=1,IN-PERSON: All Levels RESTORATIVE MEDITATION with Sarah Simon Wolff,Sarah Simon Wolff,Studio 2,1 hour &30 minutes
Broadway Dance Center,4:30 pm EDT,https://clients.mindbodyonline.com/ASP/res_a.asp?tg=22&classId=18119&classDate=5/8/2024&clsLoc=1,IN-PERSON: Int TAP with Ray Hesselink,Ray Hesselink,Studio B,1 hour &30 minutes
Broadway Dance Center,6:00 pm EDT,https://clients.mindbodyonline.com/ASP/res_a.asp?tg=22&classId=19169&classDate=5/8/2024&clsLoc=1,IN-PERSON: Adv Beg STREET JAZZ/HIP-HOP with Carlos Neto,Carlos Neto,Studio 5,1 hour &30 minutes
Broadway Dance Center,6:00 pm EDT,https://clients.mindbodyonline.com/ASP/res_a.asp?tg=22&classId=19176&classDate=5/8/2024&clsLoc=1,IN-PERSON: Beg HIP-HOP FOUNDATIONS with Ms Vee,Ms Vee,Studio 2,1 hour &30 minutes
Broadway Dance Center,7:30 pm EDT,https://clients.mindbodyonline.com/ASP/res_a.asp?tg=22&classId=19424&classDate=5/8/2024&clsLoc=1,IN-PERSON: Adv Beg JUMPS AND TURNS with Maddison Clay,Maddison Clay,Studio 4,1 hour &30 minutes
Broadway Dance Center,7:30 pm EDT,https://clients.mindbodyonline.com/ASP/res_a.asp?tg=22&classId=18831&classDate=5/8/2024&clsLoc=1,IN-PERSON: Basic AFRO'DANCE with Angel Kaba,Angel Kaba,Studio 2,1 hour &30 minutes
Broadway Dance Center,7:30 pm EDT,https://clients.mindbodyonline.com/ASP/res_a.asp?tg=22&classId=18262&classDate=5/8/2024&clsLoc=1,IN-PERSON: Int Adv CONTEMPORARY JAZZ with Nijawwon Matthews,Nijawwon Matthews,Studio A,1 hour &30 minutes
Broadway Dance Center,9:00 pm EDT,https://clients.mindbodyonline.com/ASP/res_a.asp?tg=22&classId=19329&classDate=5/8/2024&clsLoc=1,IN-PERSON: All Levels STREET STYLES CHOREOGRAPHY with Eric Delgado,Eric Delgado,Studio 5,1 hour &30 minutes
Broadway Dance Center,9:00 pm EDT,https://clients.mindbodyonline.com/ASP/res_a.asp?tg=22&classId=19733&classDate=5/8/2024&clsLoc=1,IN-PERSON: Int Adv JAZZ with Malia Baker,Malia Baker,Studio A,1 hour &30 minutes
Broadway Dance Center,9:00 am EDT,https://clients.mindbodyonline.com/ASP/res_a.asp?tg=22&classId=19369&classDate=5/8/2024&clsLoc=1,IN-PERSON: Beg BALLET with Eureka Nakano Grimes,Eureka Nakano Grimes,Studio 1,1 hour &30 minutes
Broadway Dance Center,10:30 am EDT,https://clients.mindbodyonline.com/ASP/res_a.asp?tg=22&classId=19285&classDate=5/8/2024&clsLoc=1,IN-PERSON: Adv Beg HIP-HOP with Paolo Penala,Paolo Slice Penala,Studio 5,1 hour &30 minutes
Broadway Dance Center,10:30 am EDT,https://clients.mindbodyonline.com/ASP/res_a.asp?tg=22&classId=18929&classDate=5/8/2024&clsLoc=1,IN-PERSON: Basic THEATER with Melodye Redding,Melodye Redding,Studio A,1 hour &30 minutes
Broadway Dance Center,10:30 am EDT,https://clients.mindbodyonline.com/ASP/res_a.asp?tg=22&classId=19621&classDate=5/8/2024&clsLoc=1,IN-PERSON: Int JAZZ with Kenna Morris Garcia,Kenna Morris Garcia,Studio 2,1 hour &30 minutes
Broadway Dance Center,12:00 pm EDT,https://clients.mindbodyonline.com/ASP/res_a.asp?tg=22&classId=18677&classDate=5/8/2024&clsLoc=1,IN-PERSON: Adv Beg CONTEMPORARY LYRICAL with Tracie Stanfield,Tracie Stanfield,Studio A,1 hour &30 minutes
Broadway Dance Center,12:00 pm EDT,https://clients.mindbodyonline.com/ASP/res_a.asp?tg=22&classId=19419&classDate=5/8/2024&clsLoc=1,IN-PERSON: All Levels PILATES FUSION with Jacquie Maitner,Jacquie Maitner,Studio 4,1 hour &30 minutes
Broadway Dance Center,12:00 pm EDT,https://clients.mindbodyonline.com/ASP/res_a.asp?tg=22&classId=18221&classDate=5/8/2024&clsLoc=1,IN-PERSON: Beg THEATER TAP with Doug Shankman,Doug Shankman,Studio B,1 hour &30 minutes
Broadway Dance Center,1:30 pm EDT,https://clients.mindbodyonline.com/ASP/res_a.asp?tg=22&classId=19243&classDate=5/8/2024&clsLoc=1,IN-PERSON: Basic HIP-HOP with Geheny Rivera,Geheny Rivera,Studio 5,1 hour &30 minutes
Broadway Dance Center,1:30 pm EDT,https://clients.mindbodyonline.com/ASP/res_a.asp?tg=22&classId=18725&classDate=5/8/2024&clsLoc=1,IN-PERSON: Beg JUMPS AND TURNS with Eric Campros,Tracie Stanfield (3),Studio A,1 hour &30 minutes
Broadway Dance Center,1:30 pm EDT,https://clients.mindbodyonline.com/ASP/res_a.asp?tg=22&classId=19266&classDate=5/8/2024&clsLoc=1,IN-PERSON: Int THEATER with Tanner Lane,Tanner Lane,Studio 1,1 hour &30 minutes
Broadway Dance Center,3:00 pm EDT,https://clients.mindbodyonline.com/ASP/res_a.asp?tg=22&classId=18179&classDate=5/8/2024&clsLoc=1,IN-PERSON: Adv Beg TAP with Brent McBeth,Brent McBeth,Studio B,1 hour &30 minutes
Broadway Dance Center,3:00 pm EDT,https://clients.mindbodyonline.com/ASP/res_a.asp?tg=22&classId=19352&classDate=5/8/2024&clsLoc=1,IN-PERSON: Beg THEATER with Josh Zacher,Lainie Munro (4),Studio 2,1 hour &30 minutes
Broadway Dance Center,3:00 pm EDT,https://clients.mindbodyonline.com/ASP/res_a.asp?tg=22&classId=19313&classDate=5/8/2024&clsLoc=1,IN-PERSON: Int STREET JAZZ with Bo Park,Bo Park,Studio 5,1 hour &30 minutes
Broadway Dance Center,4:30 pm EDT,https://clients.mindbodyonline.com/ASP/res_a.asp?tg=22&classId=19324&classDate=5/8/2024&clsLoc=1,IN-PERSON: Adv Beg CONTEMPORARY with alma Collective,Casey Kitazumi (5),Studio 4,1 hour &30 minutes
Broadway Dance Center,4:30 pm EDT,https://clients.mindbodyonline.com/ASP/res_a.asp?tg=22&classId=18692&classDate=5/8/2024&clsLoc=1,IN-PERSON: Adv Beg THEATER with Jason Wise,Jason Wise,Studio A,1 hour &30 minutes
Broadway Dance Center,4:30 pm EDT,https://clients.mindbodyonline.com/ASP/res_a.asp?tg=22&classId=18712&classDate=5/8/2024&clsLoc=1,IN-PERSON: Beg BALLET with Dorit Koppel,Dorit Koppel,Studio 1,1 hour &30 minutes
Broadway Dance Center,6:00 pm EDT,https://clients.mindbodyonline.com/ASP/res_a.asp?tg=22&classId=18734&classDate=5/8/2024&clsLoc=1,IN-PERSON: Adv Beg COMMERCIAL JAZZ with Debbie Wilson,Debbie Wilson,Studio A,1 hour &30 minutes
Broadway Dance Center,6:00 pm EDT,https://clients.mindbodyonline.com/ASP/res_a.asp?tg=22&classId=18333&classDate=5/8/2024&clsLoc=1,IN-PERSON: Adv Beg TAP with Mark Albrecht,Mark Albrecht,Studio B,1 hour &30 minutes
Broadway Dance Center,6:00 pm EDT,https://clients.mindbodyonline.com/ASP/res_a.asp?tg=22&classId=18818&classDate=5/8/2024&clsLoc=1,IN-PERSON: Int Adv THEATER with Josh Assor,Josh Assor,Studio 1,1 hour &30 minutes
Broadway Dance Center,7:30 pm EDT,https://clients.mindbodyonline.com/ASP/res_a.asp?tg=22&classId=18887&classDate=5/8/2024&clsLoc=1,IN-PERSON: All Levels TAP with Gwen Potter,Gwen Potter,Studio B,1 hour &30 minutes
Broadway Dance Center,7:30 pm EDT,https://clients.mindbodyonline.com/ASP/res_a.asp?tg=22&classId=19204&classDate=5/8/2024&clsLoc=1,IN-PERSON: Basic HIP-HOP with Q,Q,Studio 5,1 hour &30 minutes
Broadway Dance Center,7:30 pm EDT,https://clients.mindbodyonline.com/ASP/res_a.asp?tg=22&classId=19377&classDate=5/8/2024&clsLoc=1,IN-PERSON: Int THEATER with Amanda LaMotte,Amanda LaMotte,Studio 1,1 hour &30 minutes
Broadway Dance Center,9:00 pm EDT,https://clients.mindbodyonline.com/ASP/res_a.asp?tg=22&classId=18878&classDate=5/8/2024&clsLoc=1,IN-PERSON: Int Adv HIP-HOP with David Thomas,David Thomas,Studio 1,1 hour &30 minutes
